-1,Jenna Ellis becomes latest Trump lawyer to plead guilty over efforts to overturn Georgia's election
-1,Rep. Matt Gaetz insinuates GOP Rep. Jason Smith is a closeted gay man | And Smith isn't the only Republican who is being accused of living a closeted life...
-1,Workers call for end of political messages on Willamette bridges after Israel light display dispute
0,"Biden takes swipe at Trump, GOP at fundraiser: ‘Democracy is at stake in 2024’"
0,Meta sued by 33 state AGs for addictive features targeting kids
0,A teenager is among the first boat arrivals sent to Nauru in nine years
-1,Conservative MP arrested on suspicion of rape and possession of drugs
-1,Chinese university students told to avoid private memorial events for former premier Li Keqiang
0,"Italian tech giant Camozzi sticks with Russia, supply chain hints at military collaborations"
1,Restoring Irpin: Ukrainian Workers Rebuild City After Russian Occupation
-1,"Georgia lieutenant governor wants to pay teachers $10,000 to carry guns"
-1,600 Americans are estimated to be trapped in Gaza
-1,Qatar awards death penalty to 8 ex-Indian Navy officers for espionage - Timeline
-1,Ukraine war orders starting to boost revenues for big US defense contractors
-1,"Speaker Mike Johnson has a plan to avoid a shutdown, and the far-right is fine with it"
-1,Oregon rock climber charged over mass killing plot at Smith Rock mountaineering event
0,Donald Trump’s 2020 Cronies Appear to Be Ditching Him One by One
-1,"Li Keqiang, former premier of China, dead after heart attack"
0,India to resume some visa services in Canada
-1,US House Republicans eye stopgap funding measure to head off shutdown risk
-1,MAGA Diehards Are Furious Jenna Ellis Pleaded Guilty After Raising $200K
0,Yet Another Trump Election Lawyer Has Taken a Plea Deal
1,Special counsel urges judge to crack down further on Trump’s comments
0,MP Peter Bone's Wellingborough constituents look to by-election
-1,Trumpist Mike Johnson is the US House speaker. There’s plenty to fear
-1,Biden steps up calls for end to West Bank violence against Palestinians
-1,What Trump Suggests His Supporters Do to Undermine the Next Election: Donald Trump is already laying the groundwork to question the 2024 election results.
-1,Trump Civil Fraud Trial Turns To Question Of Whether Ivanka Trump Will Have To Testify
0,Rep. Schiff: Biden’s trip to Israel a ‘monumental showing of support’
-1,Republicans delay more than $1 billion in HIV program funding
-1,Israeli soldiers skirmish with Hamas inside Gaza as air strikes claim more lives
1,Japan's top court says surgery need for gender change unconstitutional
1,Supreme Court Asked (Again!) To Rule That Recording Cops Is Protected By The 1st Amendment
0,"New House Speaker Mike Johnson, an Evangelical Christian, Holds Ties to Israel’s Far Right"
0,Abbott fences off border with New Mexico for 'immigration.' Maybe just do the whole state.
-1,US Army Corps of Engineers begins cleaning up charred mess left by Maui wildfire
-1,‘He’s like a mob boss’: legal experts alarmed by Trump’s attacks on judges
0,Israeli Military Launches Major Ground Incursion In Gaza
0,"The Hungarian parliament on Tuesday refused a proposal to hold a vote on Sweden’s bid to join NATO, further delaying the Nordic country’s inclusion in the military alliance."
-1,Warning signs flash for Biden in recent polling
0,Leader of Lebanon's Hezbollah holds talks with senior Hamas and Palestinian Islamic Jihad figures
1,JP Morgan upgrades India to ‘overweight’; advises buying on dips
-1,New York Republican moves to expel George Santos from Congress
-1,Texas lawmakers weigh spending $1.5 billion on more border barriers. Experts say walls alone won’t stop migrants.
-1,"No, Hamas and Hezbollah Are Not Sending Fighters Across the Southern Border"
-1,General Staff: Russia launches major attack across entire eastern front
0,‘Pure anger’: McHenry vents after acting speaker run
1,"With Eisenhower renaming, Army’s 100+ years honoring Confederates ends"
-1,Jack Smith Asks Court To Jail Trump If He Keeps Yapping About Witnesses | The special counsel’s new court filing wants a federal gag order reinstated with time behind bars if Trump violates it.
0,'Thug’: Pelosi rips House GOP for taking direction from man ‘in court’
-1,Desperate GOP turns to election denier in race for House speaker
-1,"Peak fossil fuel demand is coming, IEA chief Birol says — and China will be key"
0,Cori Bush: Why I’m Calling for a Cease-Fire in Gaza
0,McCarthy floats proposal returning him to power and making Jordan assistant House speaker
-1,"‘History will judge us all,’ UN chief Antonio Guterres says as Israel steps up offensive in Gaza"
0,Prime minister-presumptive Tusk to discuss unblocking EU funds for Poland
1,United Nations votes overwhelmingly in favour of humanitarian truce in Gaza
-1,Nashville Suburb Roundly Rejects Scandal-Scarred MAGA Mayoral Candidate
-1,Biden warns Iran against targeting US troops in Middle East
-1,"Trump is fined $10,000 over a comment he made outside court in his New York civil fraud trial"
0,"North Korea says Israel bombed Gaza hospital, calls US “accomplice”"
-1,UN chief hits back at ‘false’ claim he justified Hamas terror attacks
-1,NYC Cooper Union Students Locked in Library During Pro-Palestine Protest
0,Jeffries calls Mike Johnson an ‘extreme right-wing ideologue’
-1,"Ahead of November's election, 26k+ Ohioans were purged from voter rolls. Here's how to see if you were affected"
0,Hungary hosts international training for military divers who salvage unexploded munitions
0,23andMe notifies customers of data breach into its 'DNA Relatives' feature
-1,Liz Cheney: Democracy Is Doomed Under a Second Trump Presidency
-1,Oklahoma attorney general files lawsuit to stop first publicly funded religious school in U.S.
-1,"Tennessee GOP Is Willing to Reject Millions in Funding, if It Avoids Complying With Federal Strings | Tennessee Republican leaders are escalating their calls to reject millions of federal dollars rather than comply with requirements over LGBTQ+ rights, abortion access and other hot-button issues"
0,The big House recruitment holes
0,Historian compares America's current divisions to the past and how we can overcome them
-1,Estonian and Lithuanian leaders criticize Orbán's meeting with Putin
0,"For Mike Johnson, Religion Is at the Forefront of Politics and Policy"
-1,"Hurricane Otis caused 27 confirmed deaths and left 4 missing. ""Not a single power line pole remained standing in the impact zone."""
1,DOE Announces $18.5 Billion In Energy Savings and Celebrates First Year Results of Better Climate Challenge
0,Why Tom Emmer couldn’t overcome far-right opposition in speaker's race
-1,Texas sues to block Biden administration from cutting wire border fencing
1,Biden administration designates 31 new 'tech hubs' to encourage innovation (and receive federal funding)
-1,"Trump Leaves NY Courtroom, Muttering ‘Unbelievable,’ After Judge Denies Directed Verdict in His Favor"
-1,"China sacks defence minister, removes ex-FM from cabinet"
0,New California law guarantees 30 minute recess break for school-aged children
-1,IDF publishes audio of Hamas terrorist calling family to brag about killing Jews
0,Israeli Flyers Dropped on Gaza Offer Cash for Intel on Hostages
0,Hamas spox storms off interview after question on massacre of civilians
0,Israel recalls diplomats from Turkey in Gaza row
0,"2,000-year-old decorated Roman sandal unearthed in Spain"
-1,Former Mayo doctor charged with fatally poisoning wife
0,Opinion: Millennials and Gen Z Are Tilting Left and Staying There
1,Taiwan Presidential Front-Runner Joins East Asia's Largest Pride March
-1,"8 Navy Veterans get death in Qatar, ""Shocked"" India to contest order"
0,Ukrainian GDP grows 9.1% in September y/y - economy ministry
0,"Consumer Reports finds more Lead and Cadmium in Chocolate, urges change at Hershey"
-1,Rep. George Santos pleads not guilty to new charges as judge sets Sept. trial
0,"Gills Onions recall linked to multistate salmonella outbreak, CDC says"
0,Slovak PM won't vote for any sanctions against Russia without assessing their potential effects on EU
0,Is Trumpworld Starting to Turn on RFK Jr.?
-1,"Lula speaks on the crisis in Gaza: ""It is not a war. It is a genocide."""
-1,Tennessee voters reject mayoral candidate who refused to disavow neo-Nazis
-1,Pakistan thwarts Indian incursion attempt in Sialkot
-1,America’s Disaster Recovery System Is a Disaster
0,"/r/WorldNews Live Thread: Russian Invasion of Ukraine Day 612, Part 1 (Thread #758)"
-1,Trump comes out against Emmer for Speaker: ‘Would be a tragic mistake’
-1,Why Chesebro cut a deal and what it means for Trump
-1,Outlaw militias torch 35 buses in Rio after crime boss is killed
-1,Drought in Brazil's Amazon reveals ancient engravings
0,Colorado secretary of state calls out Trump’s ‘deafening' silence on 14th Amendment suit
-1,Russian Embassy won't accept applications to renounce citizenship; Finnish pols weigh dual nationality
0,Two Dems Retire From Congress After Speaker Drama
0,"Ohio Secretary of State Larose Quietly Removes More Than 26,000 Ohioans From Voter Rolls"
1,Top Warren aide to join Biden’s economic team
1,Slovakia forms coalition government with pro-Russia party
1,Wes Moore endorses Alsobrooks for Maryland Senate seat
-1,"Debt Activists Bought $10M in Student Debt for $125,000 — and Canceled It All"
-1,"Terrorism a 'malignancy', knows no borders: India tells UNGA on Israel war"
-1,Elderly busker who played protest song ‘Glory to Hong Kong’ jailed for 30 days
0,Mike Johnson's Campaign Contributions From Company Tied to Russia
-1,"One prison guard, 96 abuse charges: women say ‘serial rapist’ targeted them over a decade"
-1,Li Shangfu axed as defence minister in second China leadership shock
-1,Nashville police chief’s son is suspect in shooting of two officers outside store
0,Final Army base stripped of Confederate name as Fort Gordon becomes Fort Eisenhower
-1,Hamas Armed Wing Says 'Almost 50' Israeli Hostages Killed In Raids
-1,/r/WorldNews Live Thread for 2023 Israel-Hamas Crisis (Thread 32)
-1,Establishment Republicans Are Reviving the Myth of Mitt Romney’s Martyrdom—The chaos of the past few weeks has revived the notion that Donald Trump's rise was precipitated by the Democrats' rough treatment of the Utah senator.
-1,Catholic leader says it will be hard to convince Gaza Christians not to leave
-1,It’s actually worse to overturn an election you know your side lost
0,Ukraine already exports almost 1.5 million tonnes of products via new corridor
-1,India abstains on UN vote calling for humanitarian truce in Israel-Hamas conflict
-1,Israel-Palestine: Israel kills family of Al Jazeera’s Gaza bureau chief | MEM
0,Visa holders face expulsion from UK for inciting anti-Semitism
0,The California town that could hold the key to control of the House in 2024
0,Poll: Amo leads Leonard in RI race for Congress
1,Intelligence shows Iranian-backed militias are ready to ramp up their attacks against US forces in the Middle East
-1,"Mitch McConnell says ""I'm completely recovered"" after freezing episodes"
-1,"US Demands Are Why Mineral Deal With EU Failed, EU Vice President Says"
-1,Why dysfunction in Congress could be here to stay
1,Cabinet approves India-Japan chip supply chain partnership
-1,"Spanish probe estimates more than 200,000 children abused by Roman Catholic clergy"
-1,Marjorie Taylor Greene called Alexandria Ocasio-Cortez stupid because she won’t debate her
-1,Diplomat contradicts DeSantis claims on shipping weapons to Israel
1,Special counsel seizes on Trump’s provocative rhetoric about Meadows
0,European leaders urge Serbia to 'de facto' recognise Kosovo
-1,Were the Fake Trump Signs a Prank? Or a Political Dirty Trick?
-1,"Daughter Ivanka Trump must testify at Donald Trump's civil fraud trial, New York judge rules"
-1,Tennessee GOP rejects millions in funding to avoid LGBTQ+ mandates
-1,Iran foreign minister to meet with Guterres ahead of UN vote on Israel-Hamas War
-1,Trump backs Jesus Christ for House Speaker
0,"Joint statement by the President of the French Republic, the Chancellor of the Federal Republic of Germany and the President of the Council of Ministers of the Italian Republic on the EU-facilitated Dialogue on normalisation of relations between Kosovo and Serbia"
-1,Kirby says US strikes on Iran proxies in Syria were ‘self-defense’
-1,Pro-Palestinian Protest In London Sees Thousands Call For Bombing To Stop
-1,Spotify reportedly plans to pay even less in royalties to less-popular artists
-1,U.S. man lost at sea rescued by Canadian crew west of Vancouver Island | CBC News
-1,More Americans say they support political violence ahead of the 2024 election
1,Trump storms out of court chased by Secret Service after being slapped with a second fine
-1,"Qatar sentences 8 Indians to death, reportedly on charges of spying for Israel"
1,Slovakia swears in a new Cabinet led by a populist ex-premier who opposes support for Ukraine
-1,Mitt Romney biographer offers a startling account of dysfunction in the Senate
-1,Sudan now one of the 'worst humanitarian nightmares in recent history'
-1,"Retailers urge Congress to crack down on theft, as industry ramps up lobbying effort"
0,Big banks linked to products with pangolin and leopard parts
-1,Suspected Russian GPS Jamming Risks Fresh Dangers In Black Sea Region
-1,New House Speaker Blamed School Shootings on Teaching Evolution and Abortion
-1,"Hamas Tries Another Incursion by Sea, Israeli Forces Kill Divers"
1,"Mike Johnson, a staunch conservative from Louisiana, is elected House speaker with broad GOP support"
-1,"Ramaswamy: U.S. pulling out of NATO is ‘reasonable,’ as is ‘reevaluating’ UN membership - His stance means at least two of the top four Republicans vying for the presidency are skeptical of America’s involvement in post-World War II institutions."
1,Polish opposition jointly declare desire to form government with Tusk as prime minister after winning parliamentary majority
-1,Biden unconcerned over House Speaker Mike Johnson’s election subversion record
-1,Tom Emmer scrambles to fix his Trump problem
1,EU to show Film Festival in Russia despite war in Ukraine
-1,Trump co-defendant Jenna Ellis expected to plead guilty in Georgia
-1,Venezuelans become the largest nationality for illegal U.S. border crossings
-1,"Spanish clergy sexually abused more than 200,000 children: Report"
0,"Billionaire tax needed to tackle inequalities, says EU research group"
1,‘Get the right cases to the supreme court’: inside Charles Koch’s network
-1,Teen admits to filming TikTok prank of him assaulting people at Wortham Park: 'I didn't mean it'
-1,Japan court rules it is ‘unconstitutional’ to require transgender sterilization in landmark case for LGBTQ community
-1,Dean Phillips readies for Biden challenge
-1,Russia says it rehearsed 'massive' nuclear strike
0,"Hamas, Iran Officials In Moscow For Talks"
-1,"Poison specialist Connor Bowman fatally poisoned his pharmacist wife and tried to stop autopsy, Minnesota authorities say"
-1,Roman Catholic diocese warns that fake priests are preying on California parishioners
-1,Wisconsin judge rules that GOP-controlled Senate's vote to fire top elections official had no effect
-1,"If the GOP speaker circus fails Trump, this centrist group has a plan to save him in 2024"
1,New Caledonia expands strictly protected coverage of its swath of the Pacific
-1,"Tennessee faces federal lawsuit over decades-old penalties targeting HIV-positive people | Tennessee is the only state that imposes a lifetime registration as a “violent sex offender” if convicted of engaging in sex work while living with HIV, according to the complaint."
-1,Iranian-Kurdish Activist Askari Sentenced Again To Death On New Charge
0,Russian media say Hamas delegation has arrived in Moscow
-1,"Trump’s Claim of Immunity From Prosecution Defies American History, Special Counsel Argues"
-1,Russian army tries to regain lost ground near Andriivka and Verbove – General Staff report
-1,Israeli cyber group claims: We hacked Iranian oil infrastructure systems
0,"US orders immediate halt to some AI chip exports to China, Nvidia says"
0,15 Not-Fun Facts About Speaker Mike Johnson
-1,"Nations overwhelmingly vote for ceasefire resolution at the UN, 120 vs 14"
-1,"Arab-Israeli actor Maisa Abdel Hadi arrested over her social media post about Gaza, accused of 'supporting terrorism'"
-1,Joe Manchin grows $11 million war chest as he mulls 2024 election plans
-1,Russia passes law pulling ratification of nuclear test ban treaty
-1,"UN Security Council fails again to address Israel-Hamas war, rejecting US and Russian resolutions"
-1,Biden administration looks to ban menthol cigarettes: ‘There’s no going back’
-1,Oregon Legislature: Committee dismisses complaints by Republican state senators over walkout
-1,The Biden coalition risks a damaging break over the US role in Israel’s response in Gaza
-1,Taiwan reports 15 Chinese air force planes in its air defence zone
-1,Trump rages as former acolytes turn against him under legal heat
-1,"Before Mike Johnson Was Speaker, He Was Blaming Abortion for School Shootings"
0,Estonia's Kallas belittles Orbán for Putin handshake
-1,Alex Jones must pay $1.1 billion of Sandy Hook damages despite bankruptcy - court
0,Live updates: House Republicans pick Tom Emmer as their next speaker nominee
1,"As China Looks to Broker Gaza Peace, Antisemitism Surges Online"
0,State Dept. urges U.S. citizens to evacuate Lebanon
0,‘Trial within a trial’: Trump’s strategy on verge of imploding
0,Rishi Sunak to ‘double down’ on anti-green policies in king’s speech
-1,"Hamas rockets strike Israeli cities, causing injury and destruction"
-1,Santos blows kiss at protestors after pleading not guilty to new fraud charges in New York
1,"U.S. GDP grew at a 4.9% annual pace in the third quarter, better than expected"
-1,Congressman Dean Phillips launches 'moon shot' primary challenge to Biden
-1,Biden’s comments about casualty figures in Gaza were a disgrace
0,Republicans Boo Reporter for Probing New Speaker Candidate on 2020
-1,Progress on India-Middle East-Europe Economic Corridor could be a reason behind Hamas attack: Biden
0,Trump heckled by protester chanting ‘lock him up’ ahead of rally
1,"Justice Thomas’s R.V. Loan Was Forgiven, Senate Inquiry Finds"
-1,"Election Denial, “Sexual Anarchy,” Noah’s Ark: All the Mike Johnson Details We Regret to Inform You Of"
1,Japan's Supreme Court says required sterilization surgery to officially change gender is unconstitutional
0,US judge asks Trump if he wants his federal election trial televised
1,"Biden’s New Challenger Doesn’t Remember GOP Megadonor Cash - Rep. Dean Phillips got a $2,800 donation in 2019 from Harlan Crow, the Texas billionaire who is close to Justice Clarence Thomas."
-1,Trump isn't accustomed to restrictions. That's beginning to test the legal system
0,Chandrayaan-3 blew off 2.06 tonnes of lunar soil as it landed on moon: ISRO
-1,We’ve Never Seen Anything Like the Menendez Indictment
-1,US strikes 2 facilities linked to Iranian-backed militias in Syria following series of attacks on US forces in Middle East | CNN Politics
-1,Detroit synagogue president Samantha Woll found dead outside her home
1,Hundreds of thousands rally across cities to support Palestinians
-1,Nikki Haley May Be ‘the Viable Trump Alternative.’ She May End Up Hating That.
1,US Department of Defense planning to send Iron Dome systems to Israel as F-16 fighter jets arrive in region
-1,MAGA wants their money back after Jenna Ellis pleads guilty
-1,Hurricane Otis unleashes a 'nightmare scenario' Category 5 strike on Acapulco and southern Mexico
-1,Mass protests in Panama to reject new concession for largest copper mine in Central America
1,Ukrainian defenders have partial success south of Robotyne – General Staff report | Ukrainska Pravda
-1,N. Korea blames Israel over Gaza hospital blast
1,"Germany: Arrest warrant issued for far-right politician. Daniel Halemba, who recently won a seat in Bavaria's state parliament, is being sought for an undisclosed reason. However, the 22-year-old was part of a student fraternity being investigated for displaying Nazi symbols"
-1,Air Force One debacle: Boeing has now lost more than $1 billion on each of the president's two new jets
-1,Gaza hospitals ceasing to function as water and fuel run out | Israel-Hamas war
-1,"Girls in Africa quitting school over cost of living crisis, says charity"
-1,The Republican Party’s Culture of Violence: Threats and intimidation are the new normal in the GOP.
0,"Hamas Operatives Used Phone Lines Installed In Tunnels Under Gaza To Plan Israel Attack Over 2 Years, Sources Familiar With Intelligence Say"
0,"UN chief Antonio Guterres says Hamas massacre ""didn't happen in a vacuum"""
0,Where Is Mike Johnson’s Ironclad Oath?
-1,China shows off a Tibetan boarding school that's part of a system some see as forced assimilation
0,House Democrat moves to force vote on censuring Marjorie Taylor Greene
0,Greek-born adoptees reunited
-1,"China Former Premier Li Keqiang Dies of Heart Attack, CCTV Says"
-1,"Police found Maine shooting suspect dead in recycling trailer, still investigating motive"
0,Republican radicalization takes its toll
1,Iran Says Ready To Cooperate With New Niger Regime
0,Republicans self-destruct again in US Speaker saga
0,"Lukoil chairman dies suddenly, second in just over a year"
0,Greece opens Maria Callas museum for a glimpse into opera diva’s life
-1,Currency exchange that allegedly laundered almost $230m in illegal funds busted in AFP raids
1,More in new poll say ‘patriots may have to resort to violence’ to save US
0,Israeli ambassador to UN Erdan shows UNGA video of Hamas decapitation at ceasefire debate
1,Far-right Meloni praises von der Leyen's migration stance
-1,"I went through hell, says 85-year-old hostage released by Hamas"
0,A fifth-string speaker suits up for House Republicans
-1,Trump narrowly avoids another gag order sanction in fraud trial
-1,Trump and Michael Cohen come face to face at New York fraud trial
-1,Qatar sentences Indian ex-naval officers to death
-1,House Republicans Swear They’ll Find Their Speaker This Time
-1,Several thousand stage protest in Vilnius against proposed property tax
0,"G7 calls for immediate repeal of bans on Japanese food, pressing China"
-1,Stephanie Fattman to pay record-high penalty to settle allegations that her husband schemed to boost her campaign
-1,"Queer Afghans cry for help under Taliban rule, citing private prisons, torture & death"
0,Readout of President Biden’s Call with Prime Minister Netanyahu of Israel
0,What to know about House speaker candidate Mike Johnson
0,N.C. Republicans pass redistricting map expected to flip 3 House seats
-1,High Court in South Africa rules that any parent has the right to four months parental leave
-1,Over 20 US military personnel hurt after drone attacks in Syria and Iraq
-1,Senate strikes down GOP anti-shutdown amendment creating permanent stopgap
-1,Rep. Jamaal Bowman charged with misdemeanor for pulling fire alarm in a Capitol building
-1,North Carolina Republicans Are About to Win Their War Against Democracy: Conservatives are locking in an outrageous partisan gerrymander—and locking out nearly half of the state's voters.
-1,"Israel slams UN chief for saying Hamas attack ‘did not happen in a vacuum,’ calls for his resignation"
0,Jenna Ellis set to take plea deal in Georgia case
0,Germany: Nationwide raids target neo-Nazi music scene
0,Armenia's PM Nikol Pashinyan indicates that his government does not regard refugees from Nagorno-Karabakh as Armenian citizens despite the fact that virtually all of them hold Armenian passports
-1,Detroit police confident synagogue president's slaying 'not motivated by antisemitism'
-1,"Trump fined $10,000 in what judge calls second violation of gag order"
-1,"""Dominos are falling"": Fourth Trump co-defendant pleads guilty in Georgia election subversion case"
0,Russia hikes key rate to 15% in bigger-than-expected rise
0,Republicans pick Tom Emmer as their nominee for House speaker as they try for a third time
-1,What violent threats against the Jim Jordan holdouts tell us about the GOP
-1,"Russia suddenly holds training on how to respond to ""enemy nuclear strike"""
1,The US economy grew at a robust 4.9% rate in the third quarter
0,Florida doles out $50 million to contractor providing DeSantis Israel flights
-1,"Republican House Members Turn Into Complete Jerks After Trump Question The lawmakers booed, jeered and screamed in response to a reporter."
1,Indian Navy keeps close watch on Chinese warships moving for engagement with Pakistan Navy
-1,"Nikki Haley accuses Donald Trump of pursuing ‘chaos, vendettas and drama’ at Jewish Republican event"
1,"Armenian Ambassador, Greek DM discuss bilateral defense cooperation, regional security"
1,Pennsylvania Supreme Court Race Tests Democrats’ Post-Roe Strategy On Abortion Rights
-1,Sweden has had enough of being confused with Switzerland | Sweden and Switzerland are too often confused – at least the tourism organisation Visit Sweden thinks so and is launching an advertising campaign to help clear things up.
-1,Jill Biden makes stand for LGBTQ+ community and condemns US book bans
-1,Dismay as South Korea upholds military ‘sodomy law’ for fourth time
-1,"Vocal on Israel, DeSantis Is Challenged on His Silence on Neo-Nazis in Florida"
