-1,"Myanmar crackdown on business escalates, 16 more executives jailed over palm oil import scheme"
-1,"UN secretary general says comments on Hamas attack were 'misrepresented,' as Israel retaliates with visa ban"
1,"Pope says it's ""urgent"" to guarantee governance roles for women during meeting on church future"
0,"Off-duty pilot may have been on psychedelic mushrooms when he tried to shut off plane engines, FBI says"
1,Republican Mike Johnson has secured enough votes to become House speaker as ballot draws to a close
0,Ukraine implements recommendations as quickly as possible to start accession talks with EU – Zelensky
-1,"Georgia’s lieutenant governor wants to pay teachers $10,000 a year to carry guns at school"
0,Tom Emmer drops out of Speaker’s race
0,FBI Joins Investigation into Alleged Illicit Sale of Bolsonaro Government Gifts
-1,"Gazans Release Names of 6,747 People They Say Were Killed in Israeli Strikes"
-1,Judge denies motion to block Ivanka Trump testimony in New York civil fraud trial | CNN Politics
-1,Texas Republicans Ban Women From Using Highways for Abortion Appointments
-1,France's Macron proposes that anti-Islamic State coalition fights Hamas
-1,"Jenna Ellis, Former Trump Lawyer, Pleads Guilty in Georgia Election Case"
-1,Ugandan anger at plan to name road after slain tourists
-1,The real threat Dean Phillips poses to Biden
-1,"Democrats Splinter Over Israel as the Young, Diverse Left Rages at Biden"
-1,"NHL rescinds ban on rainbow-colored Pride tape, allowing players to use it on the ice"
-1,Michigan State University 'deeply sorry' for Hitler image displayed on video boards before football game
-1,Missile strike injures six in Egypt's Taba
-1,The New House Speaker Once Helped Force the Government to Pay for a Noah’s Ark Theme Park
0,Hurricane Otis rapidly grows into Category 4 storm off Mexico's Pacific coast heading for Acapulco
0,The Return of Jim Crow
-1,Japan investigates foreign YouTubers accused of dodging train fares and stealing food
-1,Donald Trump Promises 100% Evidence Of 2020 Fraud — With A Racist Dogwhistle
-1,Analysis | Why Trumpworld could be a problem for Tom Emmer
-1,Maine police were alerted weeks ago about shooter's threats
1,"In Michigan, Muslim and Arab American Voters Reconsider Support for Biden"
-1,Venezuelan government escalates attacks on opposition's primary election as turnout tops forecast
1,Louisiana's 'In God We Trust' law tests limits of religion in public schools
-1,Biden approval rating among Democrats drops to lowest of presidency: Gallup
-1,Some Walgreens pharmacy workers say they are planning another walkout. Here are their reasons why
-1,Russian court jails physicist for 12 years in treason case
-1,Massachusetts cannabis businesses challenge constitutionality of federal drug laws
-1,Iran warns Hezbollah ready for Israel ground offensive
-1,"Judge orders Trump to take the stand in N.Y. fraud trial, fines him $10,000 for violating gag order again"
0,New research using Cold War-era spy images uncovers hundreds of Roman forts
0,"/r/WorldNews Live Thread: Russian Invasion of Ukraine Day 613, Part 1 (Thread #759)"
-1,Iran sentences 2 journalists for collaborating with US. Both covered Mahsa Amini's death
-1,Battleground State Independents Reject Biden on Economy
-1,Rep. Jared Golden alters opposition to assault weapons ban after shootings
0,"Charlottesville's Lee statue meets its end, in a 2,250-degree furnace"
-1,"500 Hamas, PIJ terrorists trained for October 7 attack in Iran last month - report"
-1,"Nine More Republicans Sign Up For Speaker Bid, Likely Public Humiliation"
0,Saturday Morning Political Cartoon Thread
-1,Dwindling fuel supplies for Gaza's hospital generators put premature babies in incubators at risk
-1,"Antisemitic hate crimes in London up 1,350%, Met police say | Hate crime"
-1,‘I killed him': How Trump torpedoed Tom Emmer’s speaker bid
-1,'I am a Zionist': How Joe Biden's lifelong bond with Israel shapes war policy
-1,"Greene says Gaetz, 7 other colleagues need to apologize to ‘heal the conference’"
-1,Lawsuit accuses Abercrombie & Fitch of funding sex-trafficking operation
1,MAGA wants to abolish plea deals to save Donald Trump
0,IDF spokesman reveals: This is the note found on the terrorist's body
-1,"The Evangelicals Calling for War on Poor People: A new, antisocial strain of the prosperity gospel is making its way into pulpits and breeding new hostility toward the least fortunate Americans."
0,Polish election candidates donate campaign banners to insulate dog shelters
-1,Fiji to withdraw name from list of nations criticising China's human rights violations of Uyghur and Muslim minorities
-1,Santos foes line up to run for his seat. Here’s who’s in. | The indicted House Republican is due in court again Friday. His Democratic and Republican rivals are preparing for a potential special election.
-1,Trudeau rolls back carbon plan under pressure from voters - BNN Bloomberg
-1,"As House speaker, Mike Johnson is as dangerous as Jim Jordan"
0,"McConnell sides with Biden on bundling Ukraine, Israel aid: ‘I view it as all interconnected’"
-1,"Mark Meadows told Trump that 2020 election fraud claims were bogus, report says"
0,Trump compares himself to Mandela and rails against Biden after filing for New Hampshire primary
-1,"As the Israel-Hamas war rages, the U.S. wants to offer Israel advice — and get advised"
-1,Republicans Pick Yet Another Election Denier As Next House Speaker
-1,House Speaker Mike Johnson Responds to New Round of Scrutiny About Black Son. The Louisiana representative cited privacy as to why there are no pictures of his “adopted” child in public family photos.
-1,"Kyrsten Sinema said she doesn't care if she loses reelection because she 'saved the Senate by myself' and can go serve 'on any board I want to,' book says"
-1,US appeals court keeps California assault weapons ban in force
-1,"Siding with Trump, the ACLU says a judge's gag order in Jan. 6 case is too sweeping"
-1,66-year-old woman’s eye gouged out in attack on security guard in Ohio
-1,"One killed, many injured as multiple explosions rock Kerala prayer meeting"
-1,Sudan Conflict: RSF Takes Control Of Nyala In Darfur
-1,Clergyman of Moscow-linked church sentenced to 15 years in prison for treason (Ukranian Pravda)
-1,Lithuania moves to ditch controversial Russian-style 'anti-gay propaganda' law
0,U.S. Rep. John Sarbanes will not seek re-election in 2024
0,German government mulls limiting migrant remittances
-1,Trump denies telling 'red haired weirdo' Mar-a-Lago billionaire about classified info
-1,"US Republican Senator Jeff Wilson arrested over carrying gun into Hong Kong, barred from leaving city"
-1,"Trump Hit With $10,000 Fine for Gag Order Violation After Judge Puts Ex-President on Witness Stand and Finds Him 'Not Credible'"
-1,Trump mocked for denying Sidney Powell was his lawyer after she pleads guilty
-1,States All Gang Up To Sue Meta Based On Highly Questionable Theories Of ‘Harm’ To Children
-1,Air Force One debacle: Boeing has now lost more than $1 billion on each of the president’s two new jets
0,Redistricting fights in these 10 states could determine which party controls the US House
-1,Jamie Lee Curtis backs Schiff in crowded California Senate race
1,"EPA to strengthen lead protections in drinking water after multiple crises, including Flint"
-1,Clarence Thomas loan report spurs new ethics criticism of US Supreme Court
-1,UAW expands strike to crucial GM SUV plant in Texas hours after automaker reports earnings
-1,Finnish investigators suspect Chinese vessel's anchor caused Balticconnector pipeline damage | News
0,Bob Menendez Got Boeing Cash After Egypt Aircraft Deal
-1,Israel tells Gazans to move south or risk being seen as 'terrorist' partner
1,GOP senators’ challenge to walkout penalties lands before Oregon Supreme Court
-1,Israel agrees to delay invasion of Gaza - WSJ Report
0,US confirms start of flight training on F-16s for Ukrainians
-1,"Mother of Travis King, soldier charged with desertion to North Korea, says family plans to 'fight charges hard'"
-1,Israel says one of its tanks accidentally hit Egyptian post near Gaza border
-1,"Hamas, ISIS, Al-Kaida terrorists, arms come to Hungary"
-1,Orban doubles down at EU summit to defend meeting Putin. One leader calls it a very wrong message
-1,Taiwan Ex-colonel Handed 20-year Prison Term For China Spying
0,"Erdoğan targets LGBT community, says Turkey needs much larger population"
1,Biden Joins Trump's Truth Social Site 'Because We Thought It Would Be Very Funny'
-1,"At least 32 dead, 14 missing after ArcelorMittal mine fire in Kazakhstan"
-1,Czech defense minister calls for country’s withdrawal from UN
-1,Biden says Hamas attacked Israel in part to stop a historic agreement with Saudi Arabia
0,Colorado judge paves way for trial on whether 14th Amendment disqualifies Trump from office
-1,Israel Suffers First Combat Injuries in Gaza as Internet Service Begins Returning to the Strip
1,Senator Bob Menendez pleads not guilty to foreign agent charge
0,Israel Conducts Its Biggest Raid Yet Into Gaza
-1,"Mike Johnson Would Rather Not Discuss His Robust Attempts to Overturn the 2020 Election - In addition to trying to block Joe Biden from becoming president, Johnson is also antiabortion and anti-LGBTQ+"
-1,Georgia prosecutors are picking up cooperators in the Trump 2020 election case. Will it matter?
-1,Ex-Republican strategist raises alarms about GOP in new book
1,"Tom Emmer drops out of contention for House speaker, hours after winning GOP nomination"
0,Trump Lawyers Finally Released the Kraken...On Him
-1,4 suspected North Korean defectors found in a small boat in South Korean waters
-1,Exclusive: Fulton County DA has discussed plea deals with at least 6 more Trump co-defendants
-1,"‘I’ve prayed for each of you': How Mike Johnson led a campaign of election denial - The new speaker, an unsung enabler of Trump’s last-ditch effort, privately urged his colleagues to oppose the election results the day before the attack on the Capitol."
1,World’s largest sovereign wealth fund loses $34 billion as all asset classes fall in third quarter
-1,Zelenskiy Claims Nuclear Plant Was Likely Target Of Russian Drone Attack In Western Ukraine
0,"With Plea Deals in Georgia Trump Case, Fani Willis Is Building Momentum"
-1,GOP Rep Wants to Cut Waistlines—and the U.S. Budget—With Ozempic
0,"Mike Johnson rebuked in blistering home state newspaper column: ""Extreme"""
-1,"Putin warns Israel-Hamas conflict could spread beyond Middle East, condemns Gaza bombing"
1,China urges Israel to abide by international law and protect civilians in Gaza
-1,"The Big Lie is expanding: Majority of Republicans now insist Trump never tried to overturn election - As Trump's legal saga unfolds, his followers are sticking their heads in the sand"
1,Biden's approval rating among Dems drops 11 points in one month
-1,Fourth Trump Co-Defendant Pleads Guilty: Jenna Ellis Takes Deal with Prosecutors in Georgia
-1,‘My children were saying: Let them just kill us’: British doctor trapped in Gaza with family calls for ceasefire
0,"Israeli troops push into Gaza for war’s ‘second stage,’ Netanyahu says"
1,Tom Emmer Flames Out Hours After Winning GOP Speaker Nomination
-1,New No Labels Plan: Deadlocking the 2024 Election?
0,"Trump thinks Jesus could be elected House Speaker, breaking with some Republicans"
-1,"'Madness in the Name of Freedom,' Says Stephen King After Maine Gun Massacre"
-1,/r/WorldNews Live Thread for 2023 Israel-Hamas Crisis (Thread 34)
1,Active shooter reported at New Jersey's Joint Base McGuire-Dix-Lakehurst
0,Bernie Sanders Responds to Biden's Request for $105 Billion Aid Package: 'We Have Crises Here at Home Too'
-1,FTX: 'Crypto King' tells judge he acted on legal advice
0,"Pro-Palestinian creators use secret spellings, code words to evade social media algorithms"
0,Russia says Israel's Gaza bombardment is against international law
-1,Republicans hope the chaos of recent weeks will become a distant memory
-1,Israel says it will ban UN staff after secretary general’s comments
-1,"War in Ukraine: Russia suffering 'significant losses' in new offensive, White House says"
-1,Pentagon: Biden orders ‘self-defense’ strikes in Syria facilities used by Iran
0,"Armenia proposes opening regional transport links as part of ‘Crossroads of Peace’ that would connect Turkey, Azerbaijan, Iran, and Georgia through Armenia."
1,Radio host Larry Elder ends Republican presidential campaign and endorses Donald Trump
1,Virginia's legislative contests may be the most important races in 2023
0,"Mike Johnson elected House speaker, ending 22 days of GOP stalemate"
0,"Türkiye, Saudi Arabia Sign MoU to Enhance Financial Cooperation"
0,Turkey Trying To Extradite Iranian Rights Activist
-1,"Bill to override states’ animal cruelty laws creates rift among farmers in Pa., nationwide"
1,"A new bill in Congress is going to 'kill' card rewards programs, says United CEO"
-1,"UN Secretary-General Antonio Guterres on Tuesday alleged violations of international law in Gaza and urged an immediate ceasefire as Israel pounds the Palestinian territory in response to Hamas attacks, with the crisis deeply dividing the Security Council"
-1,India 'exploring all legal options' after Qatari court sentences 8 Indians to death for spying
0,Liz Cheney not ruling out White House bid
1,"Orbán is proud of his relationship with Putin, he said in Brussels"
-1,"Mike Johnson Hates America, But He Believes He Can Save It | “We’re living in a completely amoral society.”"
0,"France Deploys One LHD, Two Frigates to the Eastern Mediterranean"
1,"We are the team behind Vote Early Day, a national day of action dedicated to empowering Americans to share their voice by voting early. Ask us anything!"
0,Acapulco residents are fending for themselves in absence of aid
0,Reports: Trump told Mar-a-Lago member about calls with foreign leaders
-1,"Well, We Have a Speaker. He’s an Election Denier and an Extreme Christian Fundamentalist. | Meet Mike Johnson, Republicans’ new House speaker."
-1,Iran Warns of New Fronts Against the US If Gaza War Drags On
0,France's Macron wants international coalition against Hamas
1,Jewish Florida lawmaker breaks from DeSantis and endorses Trump
1,Blinken tells UN: US doesn't want war with Iran but will defend itself
-1,‘We don’t feel safe here’: Hongkongers in UK fear long reach of Chinese government
-1,Isolationist Republicans are wrong — we need to stand up for Israel and Ukraine
0,Campaigners gather enough signatures for proposed Swiss militia reform
-1,The GOP’s Fetish for Political Violence Is Reaching Dangerous New Heights - The Jim Jordan speakership fiasco shows that the Republicans have grown so comfortable with threats and intimidation that they're now turning on each other.
-1,New GOP House Speaker Mike Johnson Has Proposed Trillions in Cuts to Social Security and Medicare
-1,Iran's Quds Force trained 500 Hamas terrorists for massacre of Israelis - report
-1,Nobody should want to be the next speaker. It’s about what comes after
-1,You’re Not Imagining It: Support for Political Violence Is Growing | Donald Trump’s vitriol is having an impact.
-1,Retired Colombian army officer gets life sentence in 2021 assassination of Haiti's president
-1,"As Bakhmut counteroffensive lags, soldiers burnt out from horrors of war"
1,Opinion: Why shouldn’t elephants have rights? They’re intelligent beings who can feel joy and sorrow
-1,U.S. strikes Iran-linked sites in Syria after attacks on American troops
0,Most Republicans say Trump didn’t even try to overturn the election
-1,White House hits Johnson over claiming gun violence was a matter of the ‘heart’
0,"5 things to know about Mike Johnson, the new House speaker"
0,Buttigieg Wants to Use Transport Money for Affordable Housing
-1,The Absurd Lawsuit That Could Bankrupt Planned Parenthood: An anti-abortion activist and Texas’s attorney general have teamed up to try to force the organization out of the state—and now an anti-abortion judge has advanced their cause.
-1,Progressives rebel against Biden’s handling of Israel-Gaza crisis
1,Anti-Hamas Sentiments Grow In Iran As Israel Becomes More Popular
0,Germany wants to drive investment in Africa
-1,"Ivanka Trump must testify at father’s fraud trial, judge rules"
1,"The ‘great wealth transfer’ isn't $73 trillion but $129 trillion, Bank of America says—and the government gave most of it to baby boomers"
-1,"41 states sue Meta, claiming Instagram, Facebook are addictive, harm kids"
0,Iohannis: Romania installs anti-drone system at Ukraine's border
1,"Ukraine ready to counterattack if Russia strikes energy plants, says Zelenskiy"
-1,"IMF: Japanese economy to drop to 4th in world, trail Germany"
0,US asks Qatar to ‘turn down the volume’ of Al Jazeera news coverage
0,Sudan opposition forces say they have seized country’s second-largest city
-1,Iranian Agents Are Trying to Sow Chaos at Pro-Palestinian Protests in UK: Report
-1,Dean Phillips’s primary challenge of Biden will face many obstacles
-1,U.S. Imposes New Sanctions to Cut Off Hamas Funding
-1,"Names released of 7,028 Palestinians killed after Biden questions death toll"
0,"Woman sues fertility doctor, says he used own sperm to impregnate her 34 years ago"
-1,Tim Scott shifts resources to Iowa amid campaign struggles
-1,US strikes Iran-linked sites in Syria in retaliation for attacks on US troops
1,"Trump inflated asset values 'arbitrarily', former lawyer Michael Cohen says on stand"
0,Georgia supreme court upholds state’s six-week abortion ban
-1,Thousands rally in downtown L.A. against Israel's air and ground war in Gaza
0,San Jose ‘meth house’ on sale for $1.5 million
0,Trump World Floats Dossier Trashing House Speaker Candidate Emmer
0,Senate Passes Resolution Condemning Anti-Semitism On College Campuses
1,Azerbaijan says peace with Armenia is within reach
0,Israeli troops carry out hourslong ground raid into Gaza before an expected wider incursion
-1,Former Trump lawyer Ellis strikes deal in Georgia case -report
-1,Americans are growing less sympathetic to Israel as war fears grow
-1,"Trump takes the witness stand in New York fraud trial, fined $10K for violating gag order"
1,"Gavin Newsom's Senate appointee won't run for a full term in 2024. With the top 3 Democratic contenders looking to make their mark, where does the race stand?"
-1,"Biden says he has ""no confidence"" in Palestinian death count"
0,"An Oregon union wants to end self-serve fuel, months after it began"
-1,Sudan army says to resume US and Saudi-led talks on ending war
0,Joly says 'everything is on the table' of potential Azerbaijan sanctions
-1,Term limits for Congress are wildly popular. But most experts say they'd be a bad idea
1,"The U.S. House is now led by an election denier extraordinaire | Mike Johnson is smart, friendly and conservative. He also tried helping Trump overturn the 2020 vote"
0,Two Israeli hostages released By Hamas
-1,"Irish citizens panel votes to recommend decriminalizing drug possession, but marijuana legalization falls one vote short"
0,"When this is over, Gaza will be very different - Israeli PM adviser"
-1,"Israel Expects Long Gaza Ground War To Crush Hamas, Raising Fears Of Grueling, Open-Ended Conflict"
-1,Many in Niger are suffering under coup-related sanctions. Junta backers call it a worthy sacrifice.
-1,Japan court rules mandatory sterilisation of people officially changing gender unconstitutional
0,"Tata to make iPhones in India, to acquire Wistron plant for about $125 mn"
0,"Israel ground forces raid Hamas sites in Gaza, withdraw - military statement"
-1,Poland Receives More South Korean FA-50 Fighter Jets
1,Additional Lawmakers Join Call for Immediate Ceasefire In Gaza
-1,Israel says its war can both destroy Hamas and rescue hostages. Their families are less certain
-1,Abortion is still under threat by dark money groups that helped overturn Roe
-1,"Hurricane Otis kills at least 27, hammers Acapulco as damage seen in billions"
1,60% of US Oil and Gas Infrastructure Now Protected by Anti-Protest Laws: Greenpeace
-1,Trump’s mounting legal troubles intensify with rough week in court
-1,White House slams Speaker Johnson’s ‘offensive accusation’ that the ‘human heart’ is to blame for mass shootings
-1,Australia Unveils $1.25 Billion Critical Minerals Plan
1,Promising new vaccine offers hope of breaking cocaine addiction
-1,EU summit turns its eyes away from Ukraine despite a commitment to stay the course with Zelenskyy
1,"In Texas, Local Laws to Prevent Travel for Abortions Gain Momentum"
-1,Cohen prepares to testify at Trump’s New York fraud trial: live updates
0,Was the vote against Jordan an anti-MAGA turning point?
-1,"Tuberville claims wars in Ukraine, Gaza were ‘created’ by Democrats"
0,House finally has a speaker as Mike Johnson wins after weeks of chaos
-1,CBS News: U.S. strikes Iranian-backed militias in eastern Syria to retaliate for attacks on U.S. troops
1,"Trump Officially Tries to Kill Tom Emmer's Speaker Bid - Just hours after Emmer won the speaker nomination, Trump posted to Truth Social and may have ended his chances immediately."
-1,"Home invasion suspect yells ""Free Palestine"" while being arrested in Studio City"
-1,Slovak Defense Minister announces halt to arms shipments to Ukraine
-1,"Kenya's Judiciary Proposes Abolishing Death Penalty, Reduced Sentences"
-1,"ACLU sides with Trump, argues Jan. 6 case gag order is unconstitutional"
1,"White House to unveil sweeping AI executive order next week, tackling immigration, safety"
1,"Florida school removed Bible from shelves over “sexually explicit content”. The Bible contains passages about naked people, drunken incest, and one sex worker who compares her well-endowed male lovers to donkeys."
-1,"American charged with murder, rape in attack on 2 U.S. tourists near a German castle"
-1,Prairies should elect more Liberals if they want voices heard on carbon pricing: rural economic development minister
-1,Syphilis and other STDs are on the rise. States lost millions of dollars to fight and treat them
-1,"Eight-hour skirmish between India, Pakistan troops triggers fear among border residents in Jammu"
1,India to partner Japan in improving semiconductor supply chain
-1,Michael Cohen Stares Down Trump and Drops Fraud Trial Bombshell
0,New Jersey restaurateur relinquishes last 'Taco Tuesday' trademark in the U.S. | CBC Radio
-1,Trump faces new peril in federal 2020 election case after lawyer pleads guilty
-1,Israel strikes in Lebanon after Hezbollah rocket barrage
1,US and Gulf nations target 'secret' Hamas investment portfolio worth up to $1 billion | CNN Business
0,"""Catastrophic"" Category 5 Hurricane Otis nears Acapulco, Mexico"
-1,Mexican president slams critics in wake of deadly hurricane: ‘They circle like vultures’
0,Netanyahu says Israel is preparing ground invasion of Gaza
-1,Israel screens unseen Hamas bodycam footage of attack
-1,"America has a revenue problem. Blame George W. Bush and Donald Trump. Even though the national debt is rising, spending can’t be blamed."
-1,George Santos goes to war with Elon Musk over ‘abhorrent’ note
1,Democrats' Rating of Biden Slips; Overall Approval at 37%
1,Montenegro’s president urges EU to grant country membership
1,New House speaker Mike Johnson praised ‘18th-century values’ in speech
0,Did Republicans just sacrifice their majority by voting for Johnson?
0,"21 species removed from endangered list due to extinction, U.S. wildlife officials say"
0,"Nicaragua is 'weaponizing' US-bound migrants as Haitians pour in on charter flights, observers say"
0,Meet the evangelical activist who’s had a 'profound influence' on Speaker Mike Johnson
0,‘This bill is dead’ — private school vouchers face a roadblock in the Texas House with days left in the session
0,Sidney Powell evidence reemerges after Donald Trump's denial
0,"In Fulton Trump probe, case unfolds as textbook RICO"
-1,Failure to act on suicide website linked to 50 UK deaths
1,"Pope Francis encourages more children to code, especially in Catholic countries"
1,Polish opposition alliance says it is ready to take power with Tusk as PM
1,"Most of Justice Thomas' $267,000 loan for an RV seems to have been forgiven, Senate Democrats say"
1,"Despite Biden's doubts, humanitarian agencies consider Gaza toll reliable (Reuters)"
0,Nazi symbols resurface in Huwara for second time in 10 days
1,"Democrats seek a classified briefing on whether House chaos helps China | In a letter Monday to top U.S. intelligence officials, lawmakers on the House select China committee say Beijing is trying to ""discredit democracy."""
0,Pro-Israel resolution is new US House leader's first act
1,Some Jewish American peace activists pay a personal price for backing ceasefire
0,US Senate panel advances nomination of Jack Lew for ambassador to Israel
-1,"Poland violated female judges rights by making them retire earlier than men, rules European court"
1,"Ex-Chief of Staff Mark Meadows granted immunity, tells special counsel he warned Trump about 2020 claims: Sources"
-1,"Russia and China at war with Canada, says Gen. Wayne Eyre"
0,Menendez’s Wife Got Mysterious Job at Egypt-Linked COVID Lab
-1,"US strikes Syria sites used by Iran, its proxies after attacks on American troops"
0,Johnson rolls toward make-or-break speaker vote with momentum
-1,Palestinians in Lebanon’s largest refugee camp brace for another round of conflict
-1,UK accused of plan to further cut cost of bananas at expense of poorest African producers | Trade policy
