-1,Trump Is Not Great at This Gag Order Thing
-1,Turkish police arrest 28 Daesh/ISIS terror suspects
-1,"Bangladesh: anti-government protests turn violent. Following violent clashes in Dhaka that left at least one person dead, Bangladesh's main opposition party has called a nationwide strike for Sunda"
-1,Maine shooting brings conflicting ideas on solution to U.S. gun violence
-1,"Taiwan found retired air force colonel guilty of operating an espionage network for China, handing him a 20-year prison term"
1,Trump Too Small' T-shirt slogan turns into US Supreme Court battle
0,"Jeff Jackson, a target of GOP maps, announces bid for NC attorney general"
0,"Bobi, the world's oldest dog ever, dies aged 31"
-1,Near-Total Internet Blackout Hits Gaza As Israel Ramps Up Strikes
-1,"No thoughts, no prayers: How to be indifferent to the mass shooting in Maine"
0,Central Florida Tourism Oversight District hired ethics board member for 911 service contract
-1,U.S. airstrikes target Iran-linked sites in Syria after U.S. troops attacked
1,Musk says Starlink will support connectivity to aid organizations in Gaza
-1,Russian journalist who protested war on live TV stripped of custody rights by Moscow Court
-1,WSJ News Exclusive | Hamas Fighters Trained in Iran Before Oct. 7 Attacks
-1,Polish PM accuses EU of “unacceptable blackmail” over unblocking funds for new government
-1,Suspect Arrested Months After Death of Indigenous Montana Woman
-1,Ukraine will strike Russian fleet in occupied Abkhazia – Zelenskyy
1,Nick Fuentes is just the latest white supremacist embraced by Defend Texas Liberty
1,"Richard Moll, who found fame as a bailiff on the original sitcom 'Night Court,' dies at 80"
0,This Billionaire Hedge Funder Is Quietly Financing Anti-Trans Advocacy Across The U.S.
-1,Democratic lawmakers push paid leave for pregnancy loss
-1,Trump’s latest insult prompts judge to weigh further penalties
0,"Blinken, Wang meet as US-China gear up towards expected leaders summit"
0,Turkish parliament set to discuss ratifying Sweden's NATO membership
1,North Carolina lawmakers approve maps creating gains for the GOP in Congress
-1,Mike Johnson helped Trump on January 6 - now he’s a threat to democracy
0,More customers of Falasz Tax in Bay City say their taxes haven't been filed
-1,"“This is an outrage”: Advocate calls out GOP for “silencing” pro-Palestinian student groups - “This is the turning of Florida College campuses into propaganda mills for the government,” advocate warns"
0,Malaysia is working with others to bring Israel to ICJ
1,Turkey's Erdogan says Hamas is not a terrorist organization
-1,"Hamas terrorists trained in Iran before attack on Israel, WSJ reports"
-1,"UAW union just ordered 6,800 workers to strike a massive Ram truck facility | CNN Business"
1,"Indonesia VP hopeful Gibran promises to develop downstream industry, green economy"
-1,"New House Speaker Once Blamed Abortions for Social Security, Medicare Cuts"
1,Mark Meadows reportedly testified to grand jury after receiving immunity
1,Speaker Johnson raises conservatives' hopes for Biden impeachment
1,Biden walks a tightrope with his support for Israel as his party’s left urges restraint
-1,Maine rep reverses stance on assault weapons ban after mass shooting
-1,Army Air Defense Units from 3 Bases Are Deploying to Middle East After 13 Drone Attacks
0,Woman returns from vacation to find Atlanta home demolished
-1,India may send more weapons to Armenia amid Azerbaijan tensions
0,Apollo 17 Samples Reveal That The Moon Is 40 Million Years Older Than Previously Thought
1,House Declares Solidarity With Israel in First Legislation Under New Speaker
-1,GOP senators pressure House to solve Speaker drama
-1,Islamist arrested on suspicion of planning terror attack at Israel rally
1,An aide to an L.A. councilman traded Holocaust jokes about Amy Schumer. Now he’s out
-1,Ancient rock carvings revealed by receding Amazon waters amid drought | Archaeology
-1,Bowman removed warning signs before pulling fire alarm: Video
-1,Judge strikes down recent NYC rules restricting gun licensing as unconstitutional
1,Mike Johnson May Win the Speakership Through Exhaustion and Delusion
-1,Netanyahu meets hostages' families anxious over war - BBC News
-1,A Ukrainian soldier went to Washington to explain the war. He says American politicians don't realize much of the funding actually stays in the US.
-1,"Gaza’s Health Ministry releases full list of Palestinians killed as Biden doubts accuracy of toll: 7,028 killed, among them 2,913 children."
1,Meta says it locked pro-Palestinian accounts after signs of security compromise
0,House Republican tells reporter to ‘shut up’ for asking Johnson about overturning 2020 election
-1,"After U.S., U.K., Australia, Five eyes member New Zealand too criticises India on order expelling Canadian diplomats"
1,"Tehran, Moscow to boost tech ties"
-1,"Amid Intense Fighting, Ukraine Orders Evacuation of Children"
-1,DeSantis says he's sending weapons to Israel in move that could bolster him in the GOP primary
-1,"Trump 2020 lawyer Jenna Ellis pleads guilty in Georgia election case, the latest to flip"
0,Canada says it has completed talks on bilateral investment deal with Taiwan
-1,"Israel protests Russian stance on war against Hamas, calls for 'more balance'"
1,"Hamas ready to release all Russian hostages as two are ""closest friends"""
-1,"Speaker Johnson on shootings: ""Problem is the human heart, not guns"""
0,Sarah Huckabee Sanders defends herself from podium controversy after unusual $19K payment
0,Iran Court Orders US to Pay Damages for 1980 Hostage Rescue Attempt
0,Switzerland suspends funding of 11 Palestinian and Israeli NGOs
-1,WSJ – Hamas Terrorists Trained In Iran Before Israel Attacks
-1,US strikes Syria bases used by Iran-linked groups
-1,Biden says he has 'no confidence' in Palestinian death count
0,"U.S. Quietly Pushes Ahead Secret Military Base in Israel, Near Gaza"
-1,"Pedro Argote, man who allegedly killed Maryland judge Andrew Wilkinson, found dead: Officials"
-1,"Jeff Jackson, NC congressman drawn out of his seat, will run for NC attorney general 'to fight political corruption'"
0,Gas prices plummet as some states fall below $3 a gallon
-1,Trump Vows to Block Immigrants Who ‘Don’t Like Our Religion’
-1,AP Sources: Auto workers and Stellantis reach tentative contract deal that follows model set by Ford
-1,Blinken says he asked Qatari PM to rein in Al Jazeera's Israel-Hamas war coverage: sources
-1,Israel to refuse visas to UN officials after Guterres speech on Gaza war
-1,"Democratic Rep. Jared Golden reverses course, now in favor of assault weapons ban after Maine mass shootings"
0,"White House scrambles to repair relations with Arab, Muslim Americans"
-1,Germany arrests businessman suspected of selling drone engines to Russia
0,"Discussion Thread: 2023 US House Speaker Election, Day of October 25"
1,Lederhosen in the Amazon: an Austro-German enclave in Peru keeps traditions alive
-1,France says Russian state hackers breached numerous critical networks
-1,Ukraine suspends traffic along Black Sea grain corridor due to threat from Russian warplanes
-1,"Earth’s ‘vital signs’ worse than at any time in human history, scientists warn"
-1,"Tennessee GOP is willing to reject millions in funding, if it avoids complying with federal strings"
0,Advocacy groups call on Congress to reauthorize global HIV initiative
-1,India Ramps Up Border Drone Defense After Hamas Attack on Israel
-1,Many Israelis are furious at their government's chaotic recovery efforts after Hamas attack
-1,Democrats' divisions on Israel-Hamas war boil over in Michigan as Detroit-area Muslims feel betrayed
-1,NY judge suggests Trump again violated gag order: ‘I don’t want anybody killed’
-1,British Freighter Is Believed Lost in Fatal North Sea Collision
-1,Fear and defiance in Lebanon as the threat of new war opens old wounds
-1,Iranian teenage girl dies a month after losing consciousness in disputed incident on Tehran Metro
-1,Qatar court sentences 8 ex-Indian Navy officers to death
-1,"More than 700 killed in overnight Israeli attacks, Gaza officials say"
-1,Three Injured as Rocket Hits Building in Tel Aviv
1,Democrats Introduce Bills to Create National LGBTQ+ History and Culture Museum
-1,City of Orlando buys Pulse nightclub property to build memorial to massacre victims | The gay nightclub was the site of a 2016 mass shooting where a gunman killed 49 people and wounded 53 others.
-1,"Israeli hostage, 85, shown shaking hands with Hamas captor after release | Israel-Hamas war"
-1,Federal Judge Blocks Colorado’s Abortion Drug Reversal Ban
0,Ukraine launches joint venture with German arms maker Rheinmetall - PM
-1,"Ivanka Trump must testify at her father’s civil fraud trial, judge rules"
1,Voters in at Least 10 States Are Trying to Protect Abortion Rights. GOP Officials Are Throwing Up Roadblocks | Republican officials are undermining citizen-led ballot initiatives that seek to protect the procedure. Ohio is the latest state to get protections on the November ballot
-1,UAW appears to be moving toward a potential deal with Ford that could end strike
-1,"S.Korea, Japan, US condemn North Korea's supply of arms to Russia – North Korea is seeking military assistance from Russia to advance its own military capabilities in return for its arms support for Moscow"
1,"Looking to post-war, Germany's Scholz promises EU Ukraine funding facility"
-1,ByteDance sets new lobbying record amid scrutiny of TikTok’s China ties
-1,Tennessee Republicans keep losing court battles with drag queens
-1,"Australia abstains from UN resolution calling for truce in Gaza, prompting criticism at home. Representative explains resolution ‘did not recognise terror group Hamas as perpetrator of 7 October attack’"
-1,"Environmental crime money easy to stash in US due to loopholes, report finds"
-1,GOP Speaker Nominee's Big Problem: He Wouldn’t Overturn 2020 Election
1,Abortions increased the year after Roe was overturned
1,Trump shares screenshot of private texts from House speaker candidate
0,"Label Netanyahu a 'terrorist', says Palestinian ambassador in Switzerland"
-1,MEPs propose to give seized weapons to Ukraine
-1,Special counsel accuses Trump of 'threatening' ex-chief of staff Mark Meadows following ABC News report
0,New Speaker Mike Johnson suddenly can’t remember his anti-LGBTQ+ comments
1,Police ‘stopped pro-Israel rally in Golders Green due to safety fears’
-1,Swiss election results revised after vote counting error caused by erroneous programming in data import software for three cantons
-1,Missile strikes Egyptian Red Sea town of Taba near Israeli border
-1,‘Self-preservation kicked in’: Schiff calls report DOJ granted Meadows immunity 'not surprising'
0,Virginia GOP mails voters explicit flyers on Democrat Susanna Gibson
-1,"UN reports allege murder, maiming and arbitrary detention of Palestinian children: The United Nations human rights rapporteur presses Israel to stop the abuse of minors in Gaza and the West Bank"
0,The deep inequity of the anti-college movement
-1,Senate Voted to Let Vets With Mental Issues Keep Guns Hours Before Maine Shooting - Five senators who caucus with Democrats joined Republicans in voting to adopt the amendment
0,Netanyahu: Even I will have to answer for October 7 massacre
-1,US Treasury seeking international coalition against Hamas financing. Deputy head of department says ‘the strategy that was used to counteract the Islamic State and other terrorist groups is the one we have to use here’
0,Palestine: Shireen Abu Akleh shrine desecrated in the West Bank / IFJ
-1,Maine congressman reverses his opposition to assault weapons ban
0,Dozens of bipartisan state attorneys general sue Meta for addictive features targeting kids and teens
0,European Parliament plans to transfer 150 confiscated armored vehicles to Ukraine
-1,Russia practises ‘massive’ retaliatory nuclear strike
-1,Afghan girls' education advocate is freed from Taliban prison
-1,Israel will compensate any ships damaged during its war with Hamas
-1,Imagine Handing This F****d-Up World Back to Donald Trump: Democrats had better start making the all-too-obvious case that a return to Trumpism would do untold damage to a vulnerable world.
-1,Finland says gas pipeline likely broken by ship dragging anchor
-1,Iran warns of new fronts against the US if Gaza war drags on
-1,"Trump is ‘single most dangerous threat’ to the US, warns Republican Liz Cheney"
1,America: Live Up to Your Own Principles When Dealing With Palestine | I admire the stated principles of the United States of America. I want it to live up to them.
-1,Ukraine war: Russia executing own retreating soldiers
0,Jenna Ellis Takes Plea Deal In Georgia RICO Case
-1,Finland blames Chinese ship for Baltic Sea gas pipeline damage
0,BSF Seizes Drone On India-Pak Border In Asr
-1,Israel-Hamas war puts top Democratic Senate candidates' foreign policy differences in the spotlight
0,First Photos of Mystery Jaguar Spotted in Southern Arizona Huachuca Mountains
0,"Mike Johnson elected House speaker, putting Louisiana Republican in the spotlight"
-1,Hamas says it wants all Palestinian prisoners for Gaza hostages
1,Third-party candidates see some of their best polls since Ross Perot
-1,"All-Male Commission Passes Abortion Travel Ban in Lubbock County, Texas"
-1,Abortion restrictions in Russia spark outrage as the country takes a conservative turn
-1,The Conspiracy to End America review: Trump and the fascist threat
0,Florida cargo flights arranged by DeSantis carried drones and body armor for Israel | CNN Politics
0,DeSantis calls for institutionalizing more people instead of nationalizing Florida’s red flag law in wake of Maine shooting
-1,Trump Storms Out of Courtroom in New York Civil Fraud Trial
1,Weed wins galvanize Capitol Hill’s anti-cannabis club
0,Trump Tells Supporters: ‘Don’t Worry About Voting’ on Election Day
0,Republican states swore off a voting tool. Now they're scrambling to recreate it
-1,"Iran-backed militia threatens UAE, Kuwait in response to Israel-Hamas war"
0,"Donald Trump, Eric Trump, Donald Trump Jr. and Ivanka Trump to testify"
0,What we learned from our Florida voting rights investigation
0,US probes GM's Cruise robocars over pedestrian close calls
-1,"DeSantis’s War on “Woke” Colleges Gets Even More Absurd—and Dangerous: A proposed rule for Florida’s public campuses would muzzle advocacy of issues “that polarize or divide society among political, ideological, moral, or religious beliefs.”"
-1,UN official: Hostilities in Syria have reached the worst point in four years
-1,"""The jig is up"": Trump goes beserk at news Mark Meadows' testimony could ""obliterate"" Jan. 6 defense"
-1,U.S. fighter jets strike Iran-linked sites in Syria after attacks on U.S. troops
-1,"Chinese fighter jet got within 10 feet of US bomber over South China Sea, US military says"
0,Pakistan and India start border skirmishes in contested Jammu and Kashmir region
0,"World on brink of environmental tipping points, UN says"
-1,DeSantis allies earn big paychecks on the front lines of his culture fights
1,Mike Johnson’s speaker win reveals the iron grip Trump still has on Republicans
-1,Trump's Lawyers Pull Out All the Stops to Get Jan. 6 Case Tossed
-1,Sidney Powell pushes claims that 2020 election was rigged and prosecutors 'extorted' her after she pleaded guilty to election interference
-1,Maine’s loose gun laws come under scrutiny after deadly shootings
0,Gay democrat Becca Balint moves to censure Marjorie Taylor Greene over ‘hate speech’
0,Rep. Balint Offers Resolution Censuring Marjorie Taylor Greene
-1,"Former Trump lawyer Jenna Ellis pleads guilty in Georgia election case, becomes fourth to offer plea"
1,"Colorado cannot ban unproven abortion pill reversal treatment, judge says"
0,The Immigration Debate at the Texas Legislature Has Devolved
1,Scientists Discover An Ancient Landscape In An Area On Earth ‘Less Well Known Than The Surface Of Mars’
1,Hong Kong's leader says to create new national security law in 2024
-1,"UK meat consumption at lowest level since records began, data reveals"
0,Fulton County DA is discussing plea deals with at least 5 more Trump co-defendants
0,Gay Democrat Trolls New Anti-LGBTQ House Speaker With Message To Her Wife
-1,Trump lawyers argue Senate impeachment acquittal means 2020 election interference case should be dismissed
1,New House Speaker Thinks Creationist Museum Is 'Pointing People To The Truth'
-1,Air pollution: Delhi air turns very poor but 'worst is yet to come'
-1,Rights group reports over 100 assaults by settlers on Palestinians since war’s start
0,Trump-skeptical GOP rainmakers are taking another look at Trump
-1,"Critics Bring The Receipts Over Trump's New Claim About Sidney Powell The former president said Sidney Powell was ""Never"" his attorney, contradicting ... himself."
1,"Mike Johnson Got Elected, But Matt Gaetz Is the Big Winner of GOP’s House Speaker Battle"
-1,"New York’s American Museum of Natural History to remove human remains from exhibits, including some from Indigenous and enslaved Black people"
-1,Gaza families wear ID bracelets to avoid burial in mass graves
-1,"New York Times: Hamas' stockpiles of fuel, food, water and medicine enough to keep fighting for months"
0,GOP Lawmaker Goes To Town On Matt Gaetz And His Allies In Snark-Filled Letter
1,Listen: Billionaire Brags About Trump Sharing Secret Information With Him
1,United Auto Workers union and Ford reach tentative labor agreement | CNN Business
1,Young Europeans more likely to quit driving and have fewer children to save planet
0,Ukraine says its Black Sea grain corridor is working
0,White House Rips New GOP Speaker’s ‘Offensive’ Mass Shooting Comment
0,Liz Keating is the last elected urban Republican in Ohio. November could bring extinction
-1,UN says fuel shortages will halt Gaza aid operations within a day | CNN
0,138 hostages held by Hamas in Gaza hold foreign passports
-1,Another Trump lawyer who pushed to overturn 2020 election pleads guilty
-1,Room ‘Gasped’ During Bible-Thumping GOP Conference Confrontation | A closed-door meeting of Republicans turned sour after Georgia Rep. Rick Allen took aim at Tom Emmer’s support for same-sex marriage.
0,Chevron to buy Hess Corp for $53 billion in second oil mega-merger in weeks
-1,New Report Spills How Sidney Powell Allegedly Ended Up in This Mess
-1,The Supreme Court confronts its own failure in an appalling case about guns — The justices are seriously considering whether domestic abusers have a right to own a gun
-1,Palestinian data provider says internet and phone services are cut off as Israeli army forces are expanding their activity in Gaza
-1,"South Korean, US troops drill for 'Hamas-style surprise attack' from North Korea"
0,White House opens $45 billion in federal funds to developers to covert offices to homes
-1,How the US has used its veto power at the UN in support of Israel | Israel-Palestine conflict News
1,'I was wrong': Netanyahu's rare apology with nod to Israel's intelligence bosses
-1,Houston volleyball players played in cancer awareness event. MSHSAA stripped their title.
0,"Philippines Drops China Railway Deals, Seeks Other Funders"
0,Jenna Ellis becomes 4th defendant to take plea deal in Georgia election interference case
-1,U.S. Strikes Back At Iranian-Linked Bases In Syria
0,Russian military base to remain in Armenia until 2044
0,Poland changes construction laws to curb “pathological” housing development
0,US among 14 countries to vote against UN resolution on Israel-Hamas ‘truce’
0,Republican debate broadcast partner Rumble fueled by misogyny and extremism
0,Joe Scarborough weighs in on Speaker Johnson: ‘Trump has his guy’
0,Trump calls New York judge a ‘nut job’ for ruling requiring Ivanka to testify
0,Slovakia announces the end of military aid to Ukraine
-1,Record number of red crossbills seen in Swiss Alps
-1,Missile strikes Egyptian Red Sea town near Israeli border
-1,Michigan finally bans archaic 'gay panic defence' laws
1,IDF says it will allow significantly more humanitarian aid to enter Gaza from Egypt
-1,"Russia suffers losses near Avdiivka, Ukraine holds back Russia’s advance – US National Security | Ukrainska Pravda"
0,Rudy Giuliani feels the heat to turn on Donald Trump
-1,Anti-Semites cannot be granted German citizenship under new law - minister
-1,Trump Is Actually Guilty of the Kind of Bribery Republicans Imagine Biden Did
0,"Gazans break into aid centres taking flour, supplies, UN says"
-1,"Rep. Dean Phillips will challenge Biden in Democratic presidential race: ""This is an election about the future"""
1,Hundreds of thousands rally in global cities to support Palestinians
-1,"Trump, Cohen stand to come face-to-face at New York fraud trial"
0,U.S. Tries New Tack on Russian Disinformation: Pre-Empting It
-1,'Then we can talk': Biden says no ceasefire in Israel-Hamas war until hostages released
-1,IDF says Iran behind Hamas terror; Gaza rulers blocking civilian escape to safety
0,Trump’s Vanishing Act: Why Trump Rallies Are Going Extinct
-1,Ice hockey player Johnson dies after neck cut
-1,Federal Court Deals Blow to Georgia Republicans’ Racist Congressional Map
1,Israel orders top spies to hunt down 'every single individual' involved in Hamas' October 7 massacre
0,House GOP's internal honeymoon starts to crumble
0,Man shoots himself after officers tried to question him about four escapees from Georgia jail
0,"Newsom describes harrowing beheading video, meeting with survivors during Israel trip"
-1,Voters in Wisconsin Say US Economy Is on Wrong Track. That’s Bad News for Biden
0,Tom Emmer drops out of race for speaker
-1,Amazon discloses 181 mln users in EU in first store transparency report
-1,Trump's lawyers demand fraud trial stopped because of a COVID-19 risk — but none are wearing masks in court
0,"/r/WorldNews Live Thread: Russian Invasion of Ukraine Day 610, Part 1 (Thread #756)"
-1,Scholz asks German opposition to support package to cut irregular migration
1,South korean Police to bolster crowd control measures at Halloween festival venues
1,"A mass shooting in Maine, and all Republicans can offer are prayers to the church of guns | The very least our political leaders owe us is to enact commonsense gun laws aimed at ebbing the tide of violence. But Republicans only seem capable of giving us the very least: prayers."
0,"FBI hindered Hunter probe — and David Weiss skipped briefing on Biden bribery allegations, US attorney testifies"
0,Brazil drought reveals ancient rock carvings of human faces
0,Biden campaign knocks Johnson Speakership as cementing ‘extreme MAGA takeover’ of House GOP
-1,Hiding in plain sight: The most secretive trial of 2023 is the most important antitrust trial of the century
-1,"Fort Liberty troops to deploy to Middle East amid Israel-Hamas War, Pentagon says"
-1,7 dead in crashes involving 150 vehicles on Louisiana interstate
-1,"NYC protesters demand Israeli cease-fire, at least 200 detained after filling Grand Central station"
0,Arizona's Maricopa County shatters record for heat deaths
-1,"Blinken says he asked Qatari PM to rein in Al Jazeera war coverage, per sources"
-1,India may take Canada to FATF for inaction on terror funding
-1,Ex-Trump Lawyer Jenna Ellis Pleads Guilty In Georgia 2020 Election Case
0,Opinion | Pfizer's Paxlovid price hike is a symptom of a deeper sickness
-1,"Brazil police launch fresh raids over Jan. 8 riots, Bolsonaro ally searched"
1,Ukraine Draws Breath After Southern Successes - CEPA
-1,Hamas booby traps included bomb planted in child's backpack
1,"In deep red Kentucky, Democrats bet abortion will be a winning issue in the governor's race"
-1,‘A kind of tribalism’: US supporters of Israel and Palestine fail to admit suffering of other side
0,A road has been excavated through the old Serbian cemetery in North Mitrovica - Kosovo Online
1,Argentina's third-place presidential candidate Bullrich endorses right-wing populist Milei in runoff
-1,South China Sea: Biden says US will defend the Philippines if China attacks
-1,House passes resolution condemning Hamas attacks on Israel
-1,US Strikes Iran-Linked Sites In Syria In Retaliation For Attacks On US Troops
-1,Saudi crown prince tells Biden Israel normalization can resume after war
-1,Michigan Muslims warn Democrats they’ll lose votes over Israel support: ‘Going to have a problem’ in 2024
-1,"Russia prison population plummets as convicts are sent to war – Russia has freed up to 100,000 prison inmates and sent them to fight in Ukraine, according to government statistics and rights advocates, a far greater number than was previously known"
1,Massive Cosmic Explosion Creates Rare Elements In Space
1,More mass shootings like the one in Maine? Supreme Court will soon consider unleashing the violence
-1,Maine police trawl river in manhunt for Lewiston mass shooter suspect
-1,"South Korean court upholds ban on gay sex in military, in setback for LGBTQ community"
0,"Mark Meadows walks tightrope, complying with Trump prosecutors while maintaining GOP influence"
-1,"Luxury condos used as base for scam calls, says Malaysian police"
-1,"Panama protesters detained in mine contract clashes, police injured"
0,Chicago Is Considering Opening a Municipal Grocery Store
-1,Trump Says He'll Ban Immigrants Who 'Don't Like Our Religion'
-1,French Intelligence Suspects Russia Is Behind Bedbug Hysteria
-1,Israel agrees to U.S. request to delay Gaza invasion- WSJ
