0,"Discussion Thread: 2023 US House Speaker Election, Day of October 24"
-1,‘The time has now come’: Maine congressman Jared Golden reverses course on assault weapons ban
-1,"Malaysia to warn TikTok, Meta over alleged blocking of pro-Palestinian content"
0,Nasrallah hosts Hamas and Islamic Jihad leaders in Lebanon
-1,Man Trapped Overnight in Jewelry Vault freed after door opened by timer | New York
0,More than half of Hamas' hostages have foreign nationality - Israel
-1,Rep. George Santos to be arraigned on new charges in federal fraud case
-1,India-Middle East-Europe corridor could be reason for Hamas attack on Israel: Biden - The Statesman
-1,Jordan's Queen Rania says 'no evidence' of Hamas atrocities
0,Trump Files 4 Late Night Motions in Mere Hours Over D.C. Election Case
0,Lubbock becomes largest Texas county to outlaw abortion-related travel
-1,Trump Preps for an Avalanche of Co-Conspirators to Flip | The former president's legal team has been working to find dirt on one-time allies who may be lining up to testify against Trump
0,Ron DeSantis’s claim he sent military equipment to Israel unravels
-1,Itaewon crush: Survivors are still tormented a year on
-1,Chula Vista shopping mall on lockdown after shots fired; suspects outstanding
0,"German aid to Ukraine includes recon and naval drones, anti-air systems"
-1,Lindsey Graham Screams at Newsmax Reporter for Bringing Up Tlaib in Israel Briefing
0,Fossil fuel firms spent millions on US lawmakers who sponsored anti-protest bills
0,California enacts law requiring teaching of cursive writing in schools. 17 other states have too.
-1,Full List of Democrats Who Voted to Ban Mask Mandates
0,Cornel West’s campaign manager says he’s leaving job
0,Governor Youngkin raises $30 million for state elections amid presidential buzz
1,Jamaican Supreme Court upholds colonial-era sodomy law
1,Speaker saga takeaways: Why Mike Johnson won and his coming challenges
-1,Sacramento police stop mother and 8-year-old son at gunpoint over mistaken identity
1,Naturalized Korean doctor Yohan Ihn appointed as PPP innovation committee chief
-1,Off-duty pilot charged with 83 counts of attempted murder after 'credible security threat' on Alaska Airlines flight
-1,"IMF: Japanese economy to drop to 4th in world, trail Germany | The Asahi Shimbun: Breaking News, Japan News and Analysis"
0,Newly elected House Speaker Mike Johnson is scheduled to give a talk at a Christian anti-transgender event held at a full-scale recreation of Noah's Ark
-1,78 involved in large-scale cannabis trafficking arrested in Spain and Italy
0,Pleas in Trump’s Georgia Racketeering Case Show ‘Dam Breaking’
-1,"Maine Massacre Suspect’s Anti-Transgender, Extremist Views Emerge Amid Pleas For Gun Control"
1,Meadows granted immunity deal in election interference case: ABC News
-1,British Navy replacing Chinese laundrymen with Nepali Gurkhas to prevent spying
0,Megathread: Mike Pence Suspends 2024 Presidential Campaign
-1,"Hungarian Prime Minister Viktor Orban said Thursday there is ""a very clear link between terrorist acts and migration"" as he went into an EU summit discussing a reform of the bloc's asylum rules"
1,Trump Claims Sidney Powell Was 'Never' His Lawyer After She Agrees To Plea Deal
1,Cognitive Decline? Trump Mixes Up Autocrats Who Love Him
1,Starlink will support connectivity to internationally recognized Gaza aid groups
-1,Governor signs bill to ban corporal punishment in all schools
0,"Experts reconstruct the face of Peru’s most famous mummy, a teenage Inca sacrificed in Andean snow"
-1,Jenna Ellis’s tearful guilty plea should worry Rudy Giuliani
1,"Denmark Tops Women, Peace, and Security Index: A Reflection on Global Gender Equality"
-1,"9 Arab nations condemn violations of international law in Gaza, issue statement"
-1,19 US troops have Traumatic Brain Injury after drone attacks in Iraq and Syria
-1,Congo machete attack: 26 killed by suspected Islamist militants
1,"Umm, GOP: When Did You Become the Pro-Child-Labor Party?"
0,Hamas headquarters located under Gaza hospital
1,‘How Much Blood Is Your Fun Worth?’
-1,There is only one way for many GOP candidates running against Trump to stop him. Drop out. And do it now.
1,"Huge Clarence Thomas R.V. loan forgiven by wealthy businessman, Senate investigation finds"
0,"Tom Emmer prevails in GOP balloting, becomes speaker-designate"
-1,All the people Donald Trump can't insult anymore or he'd risk violating court orders
0,Brazil scientists developing new ‘vaccine’ for cocaine addiction
1,Trump's Pardon of General Flynn Under Scrutiny After Sidney Powell Flips
-1,"At UN, Iran warns US will 'not be spared' if war in Gaza continues"
-1,"Tom Emmer drops speaker bid within hours: The MAGA cult is in a death spiral - For Trump loyalists, the possibility of total government collapse is basically a positive"
0,New GOP Speaker Mike Johnson says prayer is an appropriate House response to the Maine shootings
0,France's Macron pledges to make abortion rights 'irreversible'
-1,"H5N1 virus reaches the Antarctic for the first time - The virus was found in scavenging bird called brown skua. These migratory birds probably brought it with them from South America where bird flu has already killed an estimated 500,000 seabirds and 20,000 sea lions in Chile and Peru alone."
-1,$10 Trillion in Added US Debt Since 2001 Shows 'Bush and Trump Tax Cuts Broke Our Modern Tax Structure'
-1,Fight over Texas anti-abortion transport bans reaches biggest battlegrounds yet
0,Who is Speaker nominee Mike Johnson?
-1,Georgia’s Voting Maps Are Struck Down
0,US not drawing red lines for Israel -White House
-1,Trump to seek presidential immunity against E. Jean Carroll's 2019 damage claims
-1,"UN calls for ""immediate durable and sustained humanitarian truce"" in Israel-Hamas war"
-1,Mother files wrongful death lawsuit against now-closed Christian boarding school in Missouri
1,Gaetz: Johnson victory proves MAGA power over Republican party
0,Republicans have ruled Wisconsin for a decade – but a court decision could change that
-1,"Canada's defence minister says Hamas a threat to world, must be 'eliminated'"
1,State rep. pays tribute to men acquitted in governor kidnap plot
-1,"Ukraine Launched 'Underwater Sabotage' Attack On Sevastopol, Russian Governor Says"
0,Polish president announces date of new parliament but delays naming prime minister
0,How new congressional maps in Georgia and North Carolina will impact 2024 election
-1,WA state senator arrested in Hong Kong
-1,"200,000 people showed up for Orlando Pride in defiant middle finger to Ron DeSantis"
0,Tom Emmer drops out of Speaker race before vote
0,Graham snaps at Newsmax reporter in Israel asking about Tlaib’s tweet
-1,UN says 'civil order' starting to collapse as Gazans loot aid distribution centers - I24NEWS
-1,"Pakistan Rangers open fire on Indian posts in Jammu and Kashmir, BSF retaliating ‘befittingly’"
0,"US OKs $1.6B Tri-Nation Missile Sales to UK, Finland, Lithuania"
0,Webb Telescope Spots Never-Before-Seen Jet Stream In Jupiter’s Atmosphere
0,"Bud Light rejoins UFC with record sponsorship deal, sources say"
0,Should Salem collect a tax on workers’ wages?
-1,"US strikes back at Iranian-backed groups that attacked troops in Iraq, Syria: Pentagon"
-1,"Rep. Torres, a young N.Y. progressive, outspokenly advocates for Israel amid ongoing conflict"
0,Florida orders pro-Palestinian student group off its university campuses
0,Some of Trump’s closest allies have yet to be offered plea deals in Georgia case
0,Trump Claims He Never Gave “Red-Haired Weirdo” Classified Info About Nuclear Subs (Despite Reports to the Contrary)
-1,Germany sends new aid package to Ukraine: IRIS-T air defence system and ammunition | Ukrainska Pravda
-1,"Trump fumes after ""Fake News"" New York Times leaked audio report"
0,UK police urged to double use of facial recognition software
-1,Ex-Trump attorney Jenna Ellis pleads guilty in Georgia election interference case
0,Canada says China-linked 'Spamouflage' disinformation targeted Trudeau
0,Child casualties in Gaza a ‘stain on our conscience’: UNICEF
0,New York taxpayers will cover costs of governor’s trip to wartime Israel
-1,FTC Takes Total Wine to Federal Court to Enforce Compliance with Antitrust Civil Investigative Demand
1,"Talks on Ukraine's peace plan open in Malta: A third round of Ukrainian-backed peace talks opened in Malta Saturday with representatives from more than 60 countries but without Moscow, which condemned it as a ""blatantly anti-Russian event"""
-1,"The campaign spotlight this weekend is on Nevada, where dueling elections could confuse GOP voters"
1,"Autoworkers strike at Stellantis plant shutting down big profit center, 41,000 workers now picketing"
-1,Hurricane Otis: Dozens killed in Mexico's Guerrero state
0,China's Shenzhou-17 Mission Takes Off For Space Station
-1,Ukraine’s Army Enlists Russians Eager to Fight and Defeat Putin
0,"New US House speaker says Ukraine, Israel funding request should be split"
1,House Speaker Mike Johnson used faith in campaign against gay rights
-1,Benton County man charged after allegedly attacking another with sickle - ABC17NEWS
-1,Ex-Trump lawyer Jenna Ellis pleads guilty in Georgia election interference case.
0,McCarthy Doesn't Think Speaker of the House Hopefuls 'Understand Exactly What the Job Entails'
-1,Turkey’s Erdoğan claims LGBTQ+ people threaten the family
1,Speaker of the House Mike Johnson once wrote in support of the criminalization of gay sex
0,Donald Trump faces nightmare scenario
-1,"Civilian massacre in DR Congo as clashes spread: With 20 civilians reported killed by militants linked to the Islamic State group and rebel combat spreading closer to the provincial capital Goma, eastern DR Congo appeared in turmoil"
1,Italy backs creation of EU naval mission to patrol borders
-1,"A new hope for Ukraine aid in Washington | Speaker Johnson said the U.S. must stop Russia's advances in Ukraine, and some GOP hard-liners who oppose additional aid are hinting at a path for Congress to vote on it."
-1,Mountie fired for sex crimes accused of impersonating RCMP officer
0,Hamas fugitive living the high life in UK-funded London home - report
-1,Israeli forces raid Gaza as airstrikes drive up civilian death toll before expected invasion
1,This is not a war with Palestinians but Hamas: Israel envoy at UNGA
0,"Trump Ally Mike Johnson Elected House Speaker, Shifting GOP Further Right"
-1,Family of Maine shooting suspect says his mental health had deteriorated rapidly
0,DeSantis administration bans pro-Palestinian group from state campuses
-1,"IDF shows foreign press raw Hamas bodycam videos of murder, torture, decapitation"
-1,"Official boycott, sit-ins target Starbucks in Turkey amid protests against Israel"
-1,How the Right’s Purity Tests Are Haunting the House G.O.P.
0,Minnesota Rep. Tom Emmer selected as next GOP nominee for speaker
1,GOP speaker nominee Mike Johnson played a key role in efforts to overturn the 2020 election
0,"Republicans can’t open the House, which could shut down the government"
-1,Israel strikes near Gaza’s largest hospital after accusing Hamas of using it as a base
1,"Foster care probe uncovers 1,790 children went missing in Georgia's system"
-1,LA Councilman’s Aide Resigns After Holocaust Jokes About Amy Schumer
-1,Brazilian Researchers Develop Vaccine to Fight Cocaine Addiction
0,New speaker Mike Johnson’s 2020 election denial could have 2024 implications
-1,"China removes Li Shangfu as defense minister, who was out of public eye for 2 months"
1,EU Parliament chief to Ukraine: You should have ‘observer’ MEPs while you wait to join the bloc
0,Russia is making lethal drones with engines bought from AliExpress: Ukraine
1,Bottle redemption centers plead with lawmakers to save their businesses
-1,South Korea: Court upholds ban on gay sex within armed forces
0,Congresswoman Torres Statement on Election of GOP Extremist Mike Johnson as Speaker
-1,Remains of Poles killed by Ukrainian nationalists in WW2 massacres found in Ukraine
-1,Ancient Amazon River rock carvings exposed by drought
1,"For Afghan Refugees, India Is Far From a Safe Haven"
0,GOP Women Skipped Speaker’s Race as Male Colleagues Jumped In
1,"For Many in Wyoming, a Biden Plan to Protect Land Is Beyond Unpopular"
0,‘I would do it all over again:’ State Rep. Armando Walle of Houston defends profanity-laced tirade about proposed immigration laws
0,"Rapid ice melt in west Antarctica now inevitable, research shows"
0,Third speaker of the House nominee Tom Emmer drops out
-1,"Biden sends billions of taxpayer dollars to Israel, Ukraine amid US military recruiting crisis"
-1,Oregon State University warns to 'avoid all robots' after bomb threat involving food delivery robots
-1,"Iranian teen injured on Tehran Metro while not wearing a headscarf has died, state media says"
-1,Prominent journal editor fired for endorsing satirical article about Israel-Hamas conflict
0,Marjorie Taylor Greene forces vote on measure censuring Rashida Tlaib
1,"Hamas said to tell Moscow it's looking for 8 Russians among hostages, will free them"
1,"Despite Biden's doubts, humanitarian agencies consider Gaza toll reliable"
0,Who Chose the New House Speaker: Republicans or Trump?
0,Scientists have discovered an ancient river landscape hidden beneath the East Antarctic Ice Sheet
-1,Russia: Unacceptable to accuse us of supporting terror after Hamas visit
1,"Trump declines to endorse GOP speaker candidate for now, says he's ""trying to stay out of it"""
0,Austria to compensate gay men convicted under discriminatory laws
-1,"Bolivian prosecutors seek 30 years for former president Jeanine Áñez over 2019 Sacaba and Senkata massacres: The ex-leader of Bolivia, who is already serving another sentence for the overthrow of Evo Morales, will be tried as an ordinary citizen"
-1,‘A President Who Was Compromised’ recordings expose Donald Trump discussing classified intel
-1,Iran’s Proxies Fire Back After U.S. Airstrikes
-1,"More than 1,400 African migrants reach Spain's Canary Islands"
0,"Ohio Democratic-stronghold counties exceeding early voting expectations for election on abortion, marijuana"
-1,Banks are about to face tougher scrutiny of discrimination in lending
-1,"Ukraine’s Dnipro River Crossing Operation Widens, Kremlin Sources Say Bridgehead Will Be Crushed"
-1,US strikes back at Iranian-backed groups that attacked troops in Iraq and Syria: Officials
-1,"Jewish protesters chant 'death to Arabs,' claim Arab students threw eggs at children"
0,Hamas delegation is visiting Moscow - Russian Foreign Ministry
-1,"One in 200 Spaniards may have been Abused by Catholic Priests, rights ombudsman reports"
0,Philippine Army Told to Prepare
0,"Establishing ties between Israel and Saudi Arabia still possible, former US envoy says"
1,Home countries of major rainforests agree to work together to save them
-1,House Republicans have a multimillion dollar fundraising problem with their newest speaker
1,Tom Emmer wins Speaker nomination in GOP’s third try for the gavel (Vote 117-97 Johnson)
1,Ethnic Alliance Report Rapid Gains From Myanmar Junta Along Chinese Border
1,First raclette world championships to be held in Switzerland
-1,Retribution or 'remarkably vindictive'? Why Trump's push for more presidential power alarms his foes
0,Democrats plot end run around Tuberville blockade of military promotions
0,Tsingtao: Video shows Chinese beer worker urinating into tank
0,Russian Navy mine hunter reportedly explodes in bay at Russian-occupied Sevastopol
-1,"The “uniparty”: The far-right obsession driving GOP chaos, explained"
-1,Judge denies motion to block Ivanka Trump testimony in New York civil fraud trial
0,"George Santos told a NYT reporter his niece was kidnapped by Chinese Communists, but an official said he 'made it up'"
1,"Biden slams ""extreme MAGA takeover"" after House Republicans finally settle on a new speaker | Johnson's win marks the first time the GOP has unanimously elected a speaker since elevating John Boehner in 2011"
1,"Clarence Thomas’s $267,230 R.V. and the Friend Who Financed It"
0,Dean Phillips launches bid for president. ‘It could be the end of his political career.’
0,"Arkansas governor's $19,000 lectern remains out of sight, but not out of mind with audit underway"
-1,"Spanish clergy sexually abused over 200,000 children, says report"
1,Biden’s Primary Challenger Was Once a No-Chill Biden Fan Boy
-1,"Ivanka Trump must testify in fraud case, judge rules"
-1,Hamas didn't expect large US involvement amid war with Israel - report
-1,Donald Trump fumes over Michael Cohen's testimony
-1,"South Korea, US and Japan condemn North Korea’s alleged supply of munitions to Russia"
-1,US congressman Santos pleads not guilty to new felony charges
0,New House speaker pushed for ‘hard labor’ for abortion providers after fall of Roe
1,Christian conservatives cheer one of their own as Mike Johnson assumes Congress' most powerful seat
-1,Joe Biden: India-Middle East-EU economic corridor may be behind Hamas attack on Israel - Times of India
-1,"""Incorrect and misleading allegations"": Jack Smith accuses Trump of lying to delay Mar-a-Lago trial"
0,"/r/WorldNews Live Thread: Russian Invasion of Ukraine Day 611, Part 1 (Thread #757)"
-1,Susan Collins' gun control stance faces scrutiny after Maine mass shooting
-1,Pakistan Sets Up Deportation Centers For Illegal Migrants
-1,"Kremlin Claims It Shot Down ATACMS, Other Sources Say the US Weapons Took Out Russian Anti-Missile Systems"
0,Republicans can’t govern. Just ask them.
-1,Florida man allegedly threatened to shoot someone at CVS unless given 'all bottles' of Viagra
1,Mike Johnson Conducted Seminars Promoting the US as a “Christian Nation”
0,‘Significant Progress’ On Qatar-Led Negotiations To Release Hostages From Hamas But Issues Remain
0,A federal judge says Georgia's political maps must be redrawn for the 2024 election
0,Trumpism Is Running the House
-1,NYPD officer arrested for allegedly negotiating deals for fentanyl and heroin while on-duty
0,"Mike Johnson points to a Biden impeachment, even if the facts do not"
0,Dean Phillips Isn’t on a Kamikaze Mission. It’s More Pointless Than That.
-1,'A war crime': AOC condemns both Hamas attacks and Israeli air strikes on Gaza
0,Tom Emmer Nominated for House Speaker by Republicans
0,US Senator Menendez to be arraigned on foreign agent charge
-1,Buffy Sainte-Marie's claim to Indigenous ancestry contradicted by family members and birth certificate
1,Has the Republican Party proved to be so anti-government that it cannot govern at all?
0,Indonesia calls for probe amid ‘crime against humanity’ in Gaza
-1,US government says it plans to go after legal goods tied to illegal fentanyl trade in new strategy
1,Trump lashes out at Mark Meadows after ‘he’s granted immunity in Jan 6 case’
-1,"IAF strikes 150 Hamas tunnels, bunkers; tanks in Gaza; Gallant: War entered new phase"
0,Republican infighting torpedoes Tom Emmer's bid for US House speaker
1,"Agreement reached for Biden-Xi talks, but details still being worked out, official tells AP"
0,Gavin Newsom Wants to Export California’s Climate Laws to the World
1,Stanton Opposes ‘Most Important Architect of Electoral College Objections’ Mike Johnson for Speaker
-1,Trump files new challenges to federal election obstruction case in D.C.
0,New GOP speaker defends extreme anti-LGBTQ views: ‘Go pick up a Bible'
-1,Live updates: Israel-Hamas war rages as Gaza deaths mount
-1,Special Operations Forces destroy rare Russian radar system
-1,Antisemitism allegations feed internal conflict among Texas Republicans
-1,2 London police officers have been dismissed over the stop and search of a Black athlete couple
-1,Michael Cohen describes facing ‘pathetic’ Trump at fraud trial
0,US halts exports of most civilian firearms for 90 days
-1,Rep. Jared Golden Was Against Gun Restrictions Until the Reaper Came to His Hometown | He admitted responsibility for his 'failure' on this issue in an apology to the people of Maine.
0,House GOP gives Mike Johnson Speaker nod after whirlwind Emmer dropout
1,"US judge, scholars urge Supreme Court term limits in bipartisan push"
-1,These are the 9 Dems and 1 Republican That Voted Against the Resolution Backing Israel
-1,Rio gangsters torch at least 35 buses after Brazil crime boss killed
1,Egypt plans on welcoming 30M tourists by the end of 2028
0,White House opens $45 billion in federal funds to developers to convert offices to homes
0,"More Than Half of Hamas' Hostages Have Foreign Citizenship, Israel Says"
0,UN chief ‘shocked’ by ‘misrepresentation’ of comments in row with Israel
1,Nigeria: Supreme Court Upholds Tinubu's Election Victory
1,Xi says China willing to cooperate with US as hopes rise for talks with Biden | China | The Guardian
-1,Prosecutors want Brazil’s oldest bank to pay reparations for slavery
-1,Trump launches nasty rant at fraud trial judge: ‘CRAZED in his hatred of me’
0,"Matthew Perry, star of ‘Friends,’ dies after apparent drowning, TMZ reports"
-1,"Biden links India-Middle East-Europe Economic Corridor to Israel-Hamas war, says 'I'm convinced...'"
-1,"Flying Israeli flag 'an idiotic move,' Croatian president says"
0,"Israel recalls diplomats from Turkey, to rethink ties to Ankara"
-1,The House GOP civil war that delivered Trump is over. The radicals won
-1,Brussels attack: Two charged over suspected terror group
-1,Judge orders Ivanka Trump to testify in $250 million fraud case
0,"Trump falsely claims he ""was never indicted,"" compares himself to Nelson Mandela"
-1,Saudi defense minister to visit White House amid fears of regional war
1,‘Parasites’: Mother wins court case to evict two sons in their 40s | CNN
-1,"Off-duty pilot said 'I'm not OK' before trying to cut engines midflight, charging documents say | CBC News"
-1,Texas sues to stop Border Patrol agents from cutting state’s razor wire at the border
-1,"Indian Troops Need to Leave Maldives, Incoming President Says"
-1,"‘Weirdo’: Trump swings at Pratt, denies leaking US secrets"
0,How has RFK Jr. raised all that money?
1,Texas Supreme Court will hear case of judge who refused same-sex weddings
1,Maryland Gov. Wes Moore endorses Angela Alsobrooks for U.S. Senate
0,India to resume some visa services in Canada amid diplomatic row
-1,Swiss delegation backs decentralisation of Catholic Church
0,Trump Plots to Pull Out of NATO — If He Doesn’t Get His Way
0,Texas GOP chair stays silent on allies’ connections to antisemitic extremists
-1,New York Republicans force vote on expelling George Santos
1,Trump’s Lawyers Should Have Known Better
0,GOP presidential hopefuls call for mental hospitals following Maine shooting
0,"U.S. urges Israel against Gaza ground invasion, pushes surgical campaign"
-1,"Suspect at large after 2 active shooter incidents in area of Lewiston, Maine, sheriff says"
-1,Sen. Menendez returns to New York court to enter plea to new conspiracy charge
-1,The Funeral of a Cartel-Influencer Is Considered a Threat to Public Peace in Chile
0,Speaker Mike Johnson wanted to criminalize sodomy & called gay marriage the “harbinger of chaos”
0,They’re All “Extremists”
-1,"Blue state suspends basic skills graduation requirement again, citing harm to students of color"
-1,"Jenna Ellis, in tears, says she has 'remorse' as she takes plea deal in Georgia election case"
-1,Shouting down an election-denial question embodies the Republicans’ problem
0,‘Go pick up a Bible’: Speaker Mike Johnson defends anti-LGBTQ+ views
0,Slovakia to end military aid to Ukraine
-1,"Li Yuhan, Rights Lawyer in China, Given 6 ½ Year Sentence"
1,Clean energy is officially “unstoppable” now / The International Energy Agency says there’s no turning back in the global shift to clean energy.
0,Zimbabwe Elephant deaths: Mysterious bacterium found in bodies
1,Freedom Caucus calls on Republicans to stay in Washington until Speaker is elected
0,Bill Barr knocks Trump for having verbal skills that ‘are limited’
-1,Ministers warn English councils not to adopt four-day working weeks
-1,Trump testimony in civil fraud trial expected to begin Nov. 6
0,"/r/WorldNews Live Thread: Russian Invasion of Ukraine Day 608, Part 1 (Thread #754)"
0,"Johnson brings pro-oil, climate-skeptical record to speakership"
-1,Former China PM Li Keqiang dead at 68
-1,"Man who set fire to doors of Australian Old Parliament House admits his actions were ""not honourable"""
-1,Vietnam reports first monkeypox death
0,"2024 GOP hopefuls will defend Israel, seek donors at big Republican Jewish Coalition gathering"
0,U.S. economy glows red hot with a 4.9% GDP reading for the third quarter
0,"Mississippi should set minimum wage higher than federal level, says Democrat running for governor"
-1,"Belarus' Lukashenko says Ukraine-Russia conflict at stalemate, urges talks"
-1,Iowa woman who made fake cancer claims on social media must pay restitution but stays out of prison
0,California governor visits China and says his state will always be a partner on climate change
-1,"Hermitage fisherman who cheated in tournament, now accused of poaching deer"
-1,DeSantis administration appeals ruling against drag ban to US Supreme Court
-1,ACLU urges judge to reconsider Trump gag order in DC election case
0,IMF team to visit Pakistan next week to hold review talks
0,India communicates to France decision to procure 26 Rafale Marine jets
-1,Trump warns US enemies: spill ‘drop of American blood’ and we’ll spill ‘gallon of yours’
